<?xml version="1.0" encoding="UTF-8"?>
<DSSV xmlns:xsi="http://www.w3.org/2001/XMLSchema-instance"
      xsi:noNamespaceSchemaLocation="DSSV.xsd">

  <KHOAS>
    <KHOA>
      <MAKHOA>K01</MAKHOA>
      <TENKHOA>cntt</TENKHOA>
    </KHOA>
    <KHOA>
      <MAKHOA>K02</MAKHOA>
      <TENKHOA>qtkd</TENKHOA>
    </KHOA>
  </KHOAS>

  <LOPS>
    <LOP>
      <MALOP>L01</MALOP>
      <TENLOP>CTK45A</TENLOP>
      <MAKHOA>K01</MAKHOA>
    </LOP>
    <LOP>
      <MALOP>L02</MALOP>
      <TENLOP>QTK45A</TENLOP>
      <MAKHOA>K02</MAKHOA>
    </LOP>
  </LOPS>

  <SINHVIENS>
    <SINHVIEN>
      <MSSV>SV001</MSSV>
      <HOTEN>Nguyen Van A</HOTEN>
      <EMAIL>vana@gmail.com</EMAIL>
      <DIACHI>Can Tho</DIACHI>
      <SDT>0912345678</SDT>
      <MALOP>L01</MALOP>
    </SINHVIEN>
    <SINHVIEN>
      <MSSV>SV002</MSSV>
      <HOTEN>Tran Thi B</HOTEN>
      <EMAIL>thib@gmail.com</EMAIL>
      <DIACHI>Vinh Long</DIACHI>
      <SDT>0987654321</SDT>
      <MALOP>L02</MALOP>
    </SINHVIEN>
  </SINHVIENS>

</DSSV>
